{
  "id": "job-2024-001",
  "type": "fetch",
  "status": "completed",
  "created_at": "2024-01-01T12:00:00Z",
  "updated_at": "2024-01-01T12:01:25Z",
  "started_at": "2024-01-01T12:00:00Z",
  "completed_at": "2024-01-01T12:01:25Z",
  "input": {
    "urls": ["https://example.com/article1"],
    "max_depth": 2
  },
  "output": {
    "documents_processed": 1,
    "bytes_downloaded": 1024
  },
  "error": null,
  "metadata": {
    "version": "1.0.0",
    "priority": 5,
    "retries": 0,
    "max_retries": 3,
    "timeout_seconds": 300
  }
}
